{
  "$schema": "https://json-schema.org/draft/2020-12/schema",
  "$id": "https://vlatam.local/schemas/ai-routing-decision.schema.json",
  "title": "AI-78 routing decision v1",
  "type": "object",
  "additionalProperties": false,
  "required": [
    "schema_version",
    "status",
    "capability_id",
    "policy",
    "decision_reason",
    "decision_hash",
    "execution_correlation_id",
    "audit_correlation_id",
    "created_at",
    "benchmark_evidence",
    "review_attestation"
  ],
  "properties": {
    "schema_version": { "const": "1.0.0" },
    "status": {
      "enum": [
        "selected",
        "fallback_selected",
        "human_review_required",
        "blocked",
        "rejected"
      ]
    },
    "capability_id": { "type": "string" },
    "policy": { "type": "object" },
    "decision_reason": { "type": "string" },
    "decision_hash": { "type": "string", "pattern": "^[a-f0-9]{64}$" },
    "execution_correlation_id": { "type": "string" },
    "audit_correlation_id": { "type": "string" },
    "created_at": { "type": "string", "format": "date-time" },
    "expiry_at": { "type": "string", "format": "date-time" },
    "selected_profile_id": { "type": "string" },
    "selected_profile_version": { "type": "string" },
    "canonical_profile_key": { "type": "string" },
    "benchmark_evidence": { "type": "object" },
    "review_attestation": { "type": "object" },
    "eligibility": { "type": "object" }
  }
}
