{
  "schema_version": "1.0.0",
  "status": "selected",
  "capability_id": "evidence.extraction.normative_claims",
  "policy": {
    "policy_id": "routing.best-profile",
    "policy_version": "1.0.0",
    "policy_hash": "aaaaaaaaaaaaaaaaaaaaaaaaaaaaaaaaaaaaaaaaaaaaaaaaaaaaaaaaaaaaaaaa"
  },
  "decision_reason": "REVIEWED_WINNER_ELIGIBLE",
  "decision_hash": "bbbbbbbbbbbbbbbbbbbbbbbbbbbbbbbbbbbbbbbbbbbbbbbbbbbbbbbbbbbbbbbb",
  "execution_correlation_id": "route-execution",
  "audit_correlation_id": "route-audit",
  "created_at": "2026-07-12T01:00:00.000Z",
  "selected_profile_id": "profile.shared",
  "selected_profile_version": "1.0.0",
  "canonical_profile_key": "profile.shared@1.0.0",
  "benchmark_evidence": {},
  "review_attestation": {}
}
